{
  "$schema": "https://json-schema.org/draft/2020-12/schema",
  "$id": "https://usepocket.net/schema/connector.json",
  "title": "Pocket Connector manifest",
  "description": "A Pocket Connector: an MCP server exposing callable tools. Unlike a Skill — which is instructions loaded into context — a Connector is a running process the agent calls, so it declares transport, authentication and the tools it provides.",
  "type": "object",
  "required": ["name", "summary", "category", "author", "transport", "auth", "tools", "license"],
  "additionalProperties": false,
  "properties": {
    "$schema": { "type": "string", "format": "uri" },
    "name": {
      "description": "URL-safe identifier. Combined with the author handle it forms the connector's unique reference.",
      "type": "string",
      "pattern": "^[a-z0-9][a-z0-9-]{1,63}$"
    },
    "summary": {
      "description": "What service this connects to and what it can do. Shown on the marketplace card, so it must stand alone without the README.",
      "type": "string",
      "minLength": 15,
      "maxLength": 400
    },
    "category": {
      "type": "string",
      "enum": [
        "AI & Accelerated Computing",
        "Cloud & DevOps",
        "Data & Analytics",
        "Design & Creative",
        "Documents & Communication",
        "Healthcare & Science",
        "Research & Knowledge",
        "Sales & Marketing",
        "Security",
        "Software Engineering",
        "Tools & Automation"
      ]
    },
    "author": {
      "type": "string",
      "pattern": "^[A-Za-z0-9][A-Za-z0-9-]{0,38}$"
    },
    "transport": {
      "description": "How Pocket reaches the server. `stdio` is a local process and the most common; `http` and `sse` are hosted endpoints.",
      "type": "string",
      "enum": ["stdio", "http", "sse"]
    },
    "auth": {
      "description": "How the connector authenticates. `none` for public or local-only, `apiKey` for a single shared secret, `oauth2` when each user authorises individually.",
      "type": "string",
      "enum": ["none", "apiKey", "oauth2"]
    },
    "scopes": {
      "description": "Permissions the connector needs. Must be empty when auth is `none` — there is nothing to scope without authentication. Keep these minimal: they are shown to the user at install time, and a connector asking for more than it uses will not be trusted.",
      "type": "array",
      "items": { "type": "string", "minLength": 1, "maxLength": 60 },
      "maxItems": 20,
      "uniqueItems": true,
      "default": []
    },
    "endpoint": {
      "description": "The base URL, for `http` and `sse` transports. Must be HTTPS.",
      "type": "string",
      "format": "uri",
      "pattern": "^https://"
    },
    "command": {
      "description": "How to start the server, for the `stdio` transport.",
      "type": "object",
      "required": ["run"],
      "additionalProperties": false,
      "properties": {
        "run": { "type": "string", "minLength": 1, "description": "The executable." },
        "args": { "type": "array", "items": { "type": "string" }, "default": [] }
      }
    },
    "tools": {
      "description": "Every tool this connector exposes. Agents choose a tool by reading its description, so each one must say precisely what it does and does not do — a vague description gets the wrong tool called.",
      "type": "array",
      "minItems": 1,
      "items": {
        "type": "object",
        "required": ["name", "description", "inputSchema"],
        "additionalProperties": false,
        "properties": {
          "name": {
            "description": "Verb-first and snake_case, e.g. `create_issue` rather than `issues` — the agent reasons about the name, so it should read as an action.",
            "type": "string",
            "pattern": "^[a-z][a-z0-9_]{1,63}$"
          },
          "description": {
            "type": "string",
            "minLength": 8,
            "maxLength": 400
          },
          "inputSchema": {
            "description": "JSON Schema for the tool's parameters. This is what the model fills in, so describe every property — an undescribed field gets guessed at.",
            "type": "object",
            "required": ["type"],
            "properties": {
              "type": { "const": "object" },
              "properties": { "type": "object" },
              "required": { "type": "array", "items": { "type": "string" } }
            }
          },
          "readOnly": {
            "description": "True when the tool only reads. Lets Pocket run it without the confirmation a mutating call needs.",
            "type": "boolean",
            "default": false
          }
        }
      }
    },
    "license": { "type": "string", "minLength": 1, "maxLength": 80 },
    "homepage": { "type": "string", "format": "uri" }
  },
  "allOf": [
    {
      "description": "Hosted transports need an endpoint.",
      "if": { "properties": { "transport": { "enum": ["http", "sse"] } }, "required": ["transport"] },
      "then": { "required": ["endpoint"] }
    },
    {
      "description": "A local process needs a command to start it.",
      "if": { "properties": { "transport": { "const": "stdio" } }, "required": ["transport"] },
      "then": { "required": ["command"] }
    },
    {
      "description": "Scopes are meaningless without authentication.",
      "if": { "properties": { "auth": { "const": "none" } }, "required": ["auth"] },
      "then": { "properties": { "scopes": { "maxItems": 0 } } }
    }
  ]
}
