{
  "$schema": "https://usepocket.net/schema/connector.json",
  "name": "hubspot",
  "summary": "Read and update HubSpot contacts, companies and deals. Use for CRM hygiene and pipeline review.",
  "category": "Sales & Marketing",
  "author": "pocket",
  "transport": "stdio",
  "command": {
    "run": "npx",
    "args": [
      "-y",
      "@hubspot/mcp-server"
    ]
  },
  "auth": "oauth2",
  "scopes": [
    "crm.objects.contacts.read",
    "crm.objects.deals.read"
  ],
  "tools": [
    {
      "name": "search_contacts",
      "description": "Searches contacts by name, email or property.",
      "inputSchema": {
        "type": "object",
        "properties": {
          "query": {
            "type": "string",
            "description": "Search text."
          }
        },
        "required": [
          "query"
        ]
      },
      "readOnly": true
    },
    {
      "name": "list_deals",
      "description": "Lists deals in a pipeline stage.",
      "inputSchema": {
        "type": "object",
        "properties": {
          "stage": {
            "type": "string",
            "description": "Pipeline stage id."
          }
        },
        "required": []
      },
      "readOnly": true
    },
    {
      "name": "update_contact",
      "description": "Updates properties on a contact.",
      "inputSchema": {
        "type": "object",
        "properties": {
          "contact_id": {
            "type": "string",
            "description": "Contact id."
          },
          "properties": {
            "type": "object",
            "description": "Properties to set."
          }
        },
        "required": [
          "contact_id",
          "properties"
        ]
      }
    }
  ],
  "license": "MIT",
  "homepage": "https://hubspot.com"
}
